review_id   , product_url                                                                                            , product_name                                                        , store_name     , reviewer_name, rating, review_text                                                                                                                                                                    , review_date            , variant                      , helpful_count, scraped_at
d139ab022a9c, https://www.tokopedia.com/milano-cell/fs-milano-apple-iphone-17-256gb-garansi-resmi-1733680775158727703, [FS MILANO] Apple iPhone 17 256GB Garansi Resmi - Black             , Milano Cell    , A***t        ,      5, "Terimakasih kak😃..barang sudah sampai dengan selamat,,,sesuai pesanan,,benar2 original iBox,,segel greenpel,dapat bonus case dan tempered glass,,,hrg termurah dpat di hr...", Lebih dari 1 tahun lalu, Varian: White                ,             0, 2026-03-11T23:20:14.788394
fea4a9dcdce0, https://www.tokopedia.com/milano-cell/fs-milano-apple-iphone-17-256gb-garansi-resmi-1733680775158727703, [FS MILANO] Apple iPhone 17 256GB Garansi Resmi - Black             , Milano Cell    , O***g        ,      5, "Alhamdulillah amanah tokonya, terima kasih kak iphonenya ori ibox. Semoga di lancarkan rezekinya kak, 100% amanah"                                                            , Lebih dari 1 tahun lalu, Varian: White                ,             0, 2026-03-11T23:20:14.978525
3c4b511b3379, https://www.tokopedia.com/milano-cell/fs-milano-apple-iphone-17-256gb-garansi-resmi-1733680775158727703, [FS MILANO] Apple iPhone 17 256GB Garansi Resmi - Black             , Milano Cell    , A***g        ,      5, Realpek barang sampai dengan selamat tokonya amanah Alhamdulillah senang banget akhirnya udah bisa punya iPhone baru🥰🥰🥰💯💯💯                                               , Lebih dari 1 tahun lalu, Varian: White                ,             0, 2026-03-11T23:20:15.178262
10cf14a0830e, https://www.tokopedia.com/milano-cell/fs-milano-apple-iphone-17-256gb-garansi-resmi-1733680775158727703, [FS MILANO] Apple iPhone 17 256GB Garansi Resmi - Black             , Milano Cell    , D***y        ,      5, "Jangan ragu belanja ditokoh ini,dijamin barang datang dan kualitas barang beneran baru woyyy😍😍😍 admin nya juga pada baik baik semua 😭😭😭 berkah selalu Milano call 🤲...", Lebih dari 1 tahun lalu, Varian: White                ,             0, 2026-03-11T23:20:15.364059
ff56695b48fb, https://www.tokopedia.com/milano-cell/fs-milano-apple-iphone-17-256gb-garansi-resmi-1733680775158727703, [FS MILANO] Apple iPhone 17 256GB Garansi Resmi - Black             , Milano Cell    , Anonymous    ,      5, Kartu garansi ketinggalan kak kalau ada masalah selulernya mohon bantuannya ya kak 🙏.                                                                                         , Lebih dari 1 tahun lalu, Varian: Black                ,             0, 2026-03-11T23:20:15.605215
143019058fc2, https://www.tokopedia.com/milano-cell/fs-milano-apple-iphone-17-256gb-garansi-resmi-1733680775158727703, [FS MILANO] Apple iPhone 17 256GB Garansi Resmi - Black             , Milano Cell    , Anonymous    ,      5, "PO pas 12.12 dapt harga 7.526 hehhe, nunggu 2 minggu baru dikirim, dan 5 hari perjalanan.. Alhamdulillah ori, puass.. Karna udah sring nonton live akhir nya mutusin buat..." , Lebih dari 1 tahun lalu, Varian: Black                ,             0, 2026-03-11T23:20:15.831425
cd4b870b1912, https://www.tokopedia.com/milano-cell/fs-milano-apple-iphone-17-256gb-garansi-resmi-1733680775158727703, [FS MILANO] Apple iPhone 17 256GB Garansi Resmi - Black             , Milano Cell    , Anonymous    ,      5, "Hp muluss sampe tujuan Kalimantan tengah mantab dah, barang mulus Sampek tujuan bh 100, IMEI terdaftar, semoga awet"                                                          , Lebih dari 1 tahun lalu, Varian: Black                ,             0, 2026-03-11T23:20:16.014549
d326e9929e9e, https://www.tokopedia.com/milano-cell/fs-milano-apple-iphone-17-256gb-garansi-resmi-1733680775158727703, [FS MILANO] Apple iPhone 17 256GB Garansi Resmi - Black             , Milano Cell    , Anonymous    ,      5, "Mantap Aman sekali sampai dengan selamat,iPhone nya oriii di sini dari iBox jangan ragu yah silakan orderr,pelayanan nya Rama banget🥰🤗Terimakasih yah🙏"                    , Lebih dari 1 tahun lalu, Varian: Purple               ,             0, 2026-03-11T23:20:16.187465
86f3b1c27b60, https://www.tokopedia.com/milano-cell/fs-milano-apple-iphone-17-256gb-garansi-resmi-1733680775158727703, [FS MILANO] Apple iPhone 17 256GB Garansi Resmi - Black             , Milano Cell    , P***u        ,      5, Baru bisa kasih ulasan karena barangnya di retur karena tidak sesuai pesanan. Alhamdulillah seller amanah di kirim ulang yang sesuai pesanan Harusnya paket di terima tan...   , Lebih dari 1 tahun lalu, Varian: White                ,             0, 2026-03-11T23:20:16.331344
73b0b99a8400, https://www.tokopedia.com/milano-cell/fs-milano-apple-iphone-17-256gb-garansi-resmi-1733680775158727703, [FS MILANO] Apple iPhone 17 256GB Garansi Resmi - Black             , Milano Cell    , C***a        ,      5, Barang sesuai pesanan new ori ibox sangat rekomendasi semoga awet dan berkah untuk toko nya aamiin                                                                             , Lebih dari 1 tahun lalu, Varian: Black                ,             0, 2026-03-11T23:20:16.476545
38bf402b1131, https://www.tokopedia.com/milano-cell/fs-milano-apple-iphone-17-256gb-garansi-resmi-1733680775158727703, [FS MILANO] Apple iPhone 17 256GB Garansi Resmi - Black             , Milano Cell    , Anonymous    ,      5, Alhamdulillah aman gays saya dari Kalimantan barat barang sudah sampai terimakasih                                                                                             , Lebih dari 1 tahun lalu, Varian: Black                ,             0, 2026-03-11T23:20:19.359705
7f63a8800d9e, https://www.tokopedia.com/milano-cell/fs-milano-apple-iphone-17-256gb-garansi-resmi-1733680775158727703, [FS MILANO] Apple iPhone 17 256GB Garansi Resmi - Black             , Milano Cell    , A***a        ,      5, "Uwaaa paket ny udh nyampek, makasih kak Milano Cell. Amanah banget belanja di sini . Buat kalian yg mau order jangan khawatir di jamin amanah ."                              , Lebih dari 1 tahun lalu, Varian: White                ,             0, 2026-03-11T23:20:19.519363
d55f0f184da2, https://www.tokopedia.com/milano-cell/fs-milano-apple-iphone-17-256gb-garansi-resmi-1733680775158727703, [FS MILANO] Apple iPhone 17 256GB Garansi Resmi - Black             , Milano Cell    , Anonymous    ,      4, "Maaf ya baru sempat beri ulasan,paket smpai dengan selamat di Kab. Sidrap Sul-sel.milano tempat yg paling amanah u beli iphone garansi ibox pastinya Terima kasih puas bng...", Lebih dari 1 tahun lalu, Varian: Black                ,             0, 2026-03-11T23:20:19.694795
1de5a882f384, https://www.tokopedia.com/milano-cell/fs-milano-apple-iphone-17-256gb-garansi-resmi-1733680775158727703, [FS MILANO] Apple iPhone 17 256GB Garansi Resmi - Black             , Milano Cell    , i***l        ,      5, "Mantab semua original ibox , bunos juga dapat"                                                                                                                                , Lebih dari 1 tahun lalu, Varian: White                ,             0, 2026-03-11T23:20:19.838114
bbc5b0096c94, https://www.tokopedia.com/milano-cell/fs-milano-apple-iphone-17-256gb-garansi-resmi-1733680775158727703, [FS MILANO] Apple iPhone 17 256GB Garansi Resmi - Black             , Milano Cell    , Anonymous    ,      5, "Order 2minggu yang lalu baru kasih ulasan ini bener bener real ya new ibox masih segel dapet harga promo + free softcase antigores imei aman semuaa amaan lancar ,makasih..." , Lebih dari 1 tahun lalu, Varian: Black                ,             0, 2026-03-11T23:20:20.054367
7cb5f72e7ce0, https://www.tokopedia.com/milano-cell/fs-milano-apple-iphone-17-256gb-garansi-resmi-1733680775158727703, [FS MILANO] Apple iPhone 17 256GB Garansi Resmi - Black             , Milano Cell    , S***a        ,      5, "awal nya ragu beli nya, tapi pas udah nyampe barangnya asli bagus banget coy, ga nyesel beli nya, penjual nya ramah, packing nya rapi dan tebal. imei nya aman udah terdaf...", Lebih dari 1 tahun lalu, Varian: White                ,             0, 2026-03-11T23:20:20.204325
85abe1c1e43e, https://www.tokopedia.com/milano-cell/fs-milano-apple-iphone-17-256gb-garansi-resmi-1733680775158727703, [FS MILANO] Apple iPhone 17 256GB Garansi Resmi - Black             , Milano Cell    , Anonymous    ,      5, "Pesanan telah sampai dgn selamat,dan diksih anti gres dan silicone yg bagus,teman2 gak usah ragu belanja di milano cell dpt gold mini juga,brgnya dijamin ori garansi ibox...", Lebih dari 1 tahun lalu, Varian: Black                ,             0, 2026-03-11T23:20:20.510748
e8694c9e75db, https://www.tokopedia.com/milano-cell/fs-milano-apple-iphone-17-256gb-garansi-resmi-1733680775158727703, [FS MILANO] Apple iPhone 17 256GB Garansi Resmi - Black             , Milano Cell    , H***o        ,      5, "Kejernihan lensa: sangat bagus alhamdulillah paket sampe dengan aman dan bagus, hp nya juga berfungsi dengan baikk rekomeen untuk beli di toko iniii"                         , 5 hari lalu            , Varian: Mist Blue            ,             0, 2026-03-11T23:20:20.724383
06586c695433, https://www.tokopedia.com/milano-cell/fs-milano-apple-iphone-17-256gb-garansi-resmi-1733680775158727703, [FS MILANO] Apple iPhone 17 256GB Garansi Resmi - Black             , Milano Cell    , Anonymous    ,      5, "Alhamdulillah amanah,orisinal 100%👌😍"                                                                                                                                       , Lebih dari 1 tahun lalu, Varian: Black                ,             0, 2026-03-11T23:20:21.046187
98125386393a, https://www.tokopedia.com/milano-cell/fs-milano-apple-iphone-17-256gb-garansi-resmi-1733680775158727703, [FS MILANO] Apple iPhone 17 256GB Garansi Resmi - Black             , Milano Cell    , E***s        ,      5, "Akhirnya barang yang ditunggu-tunggu datang juga, mendarat dengan selamat, sempet g yakin mau beli online karena dari harga jauh lebih murah dari ofline tapi aku yakinin..." , Lebih dari 1 tahun lalu, Varian: Black                ,             0, 2026-03-11T23:20:21.265270
3e1f8c1a9ca2, https://www.tokopedia.com/milano-cell/fs-milano-apple-iphone-17-256gb-garansi-resmi-1733680775158727703, [FS MILANO] Apple iPhone 17 256GB Garansi Resmi - Black             , Milano Cell    , Anonymous    ,      5, "Aman terpercaya, ori ibox milano cell"                                                                                                                                        , Lebih dari 1 tahun lalu, Varian: White                ,             0, 2026-03-11T23:20:24.108672
94dce7bb583e, https://www.tokopedia.com/milano-cell/fs-milano-apple-iphone-17-256gb-garansi-resmi-1733680775158727703, [FS MILANO] Apple iPhone 17 256GB Garansi Resmi - Black             , Milano Cell    , Anonymous    ,      5, "Pertama beli hp di online... Real garansi i box donk, top deh millano... Semoga hpnya awet"                                                                                   , Lebih dari 1 tahun lalu, Varian: White                ,             0, 2026-03-11T23:20:24.275624
3f1da00b45b8, https://www.tokopedia.com/milano-cell/fs-milano-apple-iphone-17-256gb-garansi-resmi-1733680775158727703, [FS MILANO] Apple iPhone 17 256GB Garansi Resmi - Black             , Milano Cell    , Anonymous    ,      5, Awalnya si ragu tapi coba2 lah pas DTG mntp BRG original garansi tam ibox                                                                                                      , Lebih dari 1 tahun lalu, Varian: White                ,             0, 2026-03-11T23:20:24.457373
2cccf31b1ab1, https://www.tokopedia.com/milano-cell/fs-milano-apple-iphone-17-256gb-garansi-resmi-1733680775158727703, [FS MILANO] Apple iPhone 17 256GB Garansi Resmi - Black             , Milano Cell    , T***o        ,      5, Seneng banget hpnya bagus banget packingny berlapis lapis cinta banget deh pokoknya                                                                                            , Lebih dari 1 tahun lalu, Varian: Purple               ,             0, 2026-03-11T23:20:24.591211
f91112dc6d42, https://www.tokopedia.com/milano-cell/fs-milano-apple-iphone-17-256gb-garansi-resmi-1733680775158727703, [FS MILANO] Apple iPhone 17 256GB Garansi Resmi - Black             , Milano Cell    , s***i        ,      5, "pengiriman cepat dan peking nya aman, aku suka nex bakal order lg, makasih seller"                                                                                            , Lebih dari 1 tahun lalu, Varian: Black                ,             0, 2026-03-11T23:20:24.721362
5465823cf227, https://www.tokopedia.com/milano-cell/fs-milano-apple-iphone-17-256gb-garansi-resmi-1733680775158727703, [FS MILANO] Apple iPhone 17 256GB Garansi Resmi - Black             , Milano Cell    , Anonymous    ,      5, Alhamdulillah nynpk n bagus bgi yg mau bli n blum ada adaptor bli sklian aja byr g pusing cari adaptor nya klo ada bintang 10 gw kasih bintag 15 dah🤭😍😍😍 sukakkk murce...  , Lebih dari 1 tahun lalu, Varian: White                ,             0, 2026-03-11T23:20:24.898534
9507c6f25f74, https://www.tokopedia.com/milano-cell/fs-milano-apple-iphone-17-256gb-garansi-resmi-1733680775158727703, [FS MILANO] Apple iPhone 17 256GB Garansi Resmi - Black             , Milano Cell    , Anonymous    ,      5, "ALHAMDULILLAH IP 11 MELUNCUR DENGAN SELAMAT GARANSI IBOX BELI DI LIVE NYA WENNY WIJAYA , STORE MILANO SANGAT TERPERCAYA TERIMAKASIH"                                          , Lebih dari 1 tahun lalu, Varian: White                ,             0, 2026-03-11T23:20:25.159778
9c3be9c9125a, https://www.tokopedia.com/milano-cell/fs-milano-apple-iphone-17-256gb-garansi-resmi-1733680775158727703, [FS MILANO] Apple iPhone 17 256GB Garansi Resmi - Black             , Milano Cell    , Anonymous    ,      5, Alhamdulillah paket sudah sampai dengan selamat tanpa cacat.                                                                                                                   , Lebih dari 1 tahun lalu, Varian: Black                ,             0, 2026-03-11T23:20:25.439546
a13475cd8a68, https://www.tokopedia.com/milano-cell/fs-milano-apple-iphone-17-256gb-garansi-resmi-1733680775158727703, [FS MILANO] Apple iPhone 17 256GB Garansi Resmi - Black             , Milano Cell    , Anonymous    ,      5, Tahank you kak... brgnya ori smpe dgn slamt... packing.an.x double2 bublewrap jdi aman ...                                                                                     , Lebih dari 1 tahun lalu, Varian: White                ,             0, 2026-03-11T23:20:25.662547
ced4bf08583d, https://www.tokopedia.com/milano-cell/fs-milano-apple-iphone-17-256gb-garansi-resmi-1733680775158727703, [FS MILANO] Apple iPhone 17 256GB Garansi Resmi - Black             , Milano Cell    , Anonymous    ,      5, Bagus banget barangnya sesuai dan masih di segel                                                                                                                               , Lebih dari 1 tahun lalu, Varian: White                ,             0, 2026-03-11T23:20:25.874510
2d9341928917, https://www.tokopedia.com/milano-cell/fs-milano-apple-iphone-17-256gb-garansi-resmi-1733680775158727703, [FS MILANO] Apple iPhone 17 256GB Garansi Resmi - Black             , Milano Cell    , S***a        ,      5, paling terbaik🥰 bintang 100 pokoknya klw bisa🥺❤️                                                                                                                              , Lebih dari 1 tahun lalu, Varian: Black                ,             0, 2026-03-11T23:20:28.673394
1d70e717cc5f, https://www.tokopedia.com/milano-cell/fs-milano-apple-iphone-17-256gb-garansi-resmi-1733680775158727703, [FS MILANO] Apple iPhone 17 256GB Garansi Resmi - Black             , Milano Cell    , I***l        ,      5, Gak nyesel belanja online. Pokoknya bintang yang berbicara.                                                                                                                    , Lebih dari 1 tahun lalu, Varian: Black                ,             0, 2026-03-11T23:20:28.808401
a79f1ad59b37, https://www.tokopedia.com/milano-cell/fs-milano-apple-iphone-17-256gb-garansi-resmi-1733680775158727703, [FS MILANO] Apple iPhone 17 256GB Garansi Resmi - Black             , Milano Cell    , F***h        ,      5, Luar biasa amanahh barang ori mantul daah                                                                                                                                      , Lebih dari 1 tahun lalu, Varian: Black                ,             0, 2026-03-11T23:20:28.942421
53b8721d7ca0, https://www.tokopedia.com/milano-cell/fs-milano-apple-iphone-17-256gb-garansi-resmi-1733680775158727703, [FS MILANO] Apple iPhone 17 256GB Garansi Resmi - Black             , Milano Cell    , y***r        ,      5, "Trusted seller, pelayanan ramah, packaging aman sangat tebal berlapis lapis, dapat harga subsidi murah abis tambah dapat bonus tempered dan case, garansi saat hp di aktiv...", Lebih dari 1 tahun lalu, Varian: Black                ,             0, 2026-03-11T23:20:29.071053
ee5735460744, https://www.tokopedia.com/milano-cell/fs-milano-apple-iphone-17-256gb-garansi-resmi-1733680775158727703, [FS MILANO] Apple iPhone 17 256GB Garansi Resmi - Black             , Milano Cell    , Anonymous    ,      5, "Produk original IBOX kode PA/A. Pengemasan aman bubble wrap + kardus. Dapet bonus case & screenguard. Moga ada rejeki lagi buat beli disini, recommended👍"                   , Lebih dari 1 tahun lalu, Varian: Black                ,             0, 2026-03-11T23:20:29.237185
01ef1cfc3145, https://www.tokopedia.com/milano-cell/fs-milano-apple-iphone-17-256gb-garansi-resmi-1733680775158727703, [FS MILANO] Apple iPhone 17 256GB Garansi Resmi - Black             , Milano Cell    , Anonymous    ,      5, "Pengiriman cepat dan sangat aman sampai Kalimantan Tengah. Bubble wrap Berlapis-lapis + box, dan dapat bonus casing, tempered glass dan baby gold. Dapat hargadi 6,8jt."      , Lebih dari 1 tahun lalu, Varian: Black                ,             0, 2026-03-11T23:20:29.419341
79a327efdd1f, https://www.tokopedia.com/milano-cell/fs-milano-apple-iphone-17-256gb-garansi-resmi-1733680775158727703, [FS MILANO] Apple iPhone 17 256GB Garansi Resmi - Black             , Milano Cell    , G***p        ,      5, "Tokonya bagus banget,pelayanan juga cepet, adminnya fast respon, yg lebih bagusnya lagi bisa diambil di toko,jadi bisa di cek bareng sama pihak tokonya. Overall bagus rec...", 1 bulan lalu           , Varian: Mist Blue            ,             0, 2026-03-11T23:20:29.554136
cb582aa1c9b8, https://www.tokopedia.com/milano-cell/fs-milano-apple-iphone-17-256gb-garansi-resmi-1733680775158727703, [FS MILANO] Apple iPhone 17 256GB Garansi Resmi - Black             , Milano Cell    , l***l        ,      4, Packaging oke tapi belom bisa di buka hapenha karna buat kado                                                                                                                  , Lebih dari 1 tahun lalu, Varian: Purple               ,             0, 2026-03-11T23:20:29.711034
49ed14db4b94, https://www.tokopedia.com/milano-cell/fs-milano-apple-iphone-17-256gb-garansi-resmi-1733680775158727703, [FS MILANO] Apple iPhone 17 256GB Garansi Resmi - Black             , Milano Cell    , B***o        ,      5, Yang di tunggu-tunggu akhirnya datang juga. Barang Original New iPhone resmi Indonesia. Buat teman-teman yang mau order iPhone secara online aku kasih rekomendasi untuk b...  , Lebih dari 1 tahun lalu, Varian: White                ,             0, 2026-03-11T23:20:29.852718
d2aec87823be, https://www.tokopedia.com/milano-cell/fs-milano-apple-iphone-17-256gb-garansi-resmi-1733680775158727703, [FS MILANO] Apple iPhone 17 256GB Garansi Resmi - Black             , Milano Cell    , Anonymous    ,      5, Mantapp puas dgn pelayanan milano aku pesan selang 2 hari udh sampai barang ori new ibox the best semuanya befungsi dgn baik smoga awett                                       , Lebih dari 1 tahun lalu, Varian: Black                ,             0, 2026-03-11T23:20:30.018177
109a72dfca24, https://www.tokopedia.com/milano-cell/fs-milano-apple-iphone-17-256gb-garansi-resmi-1733680775158727703, [FS MILANO] Apple iPhone 17 256GB Garansi Resmi - Black             , Milano Cell    , Anonymous    ,      5, Bener2 bagus banget garansi ibox. Jangan ragu dehh. Aku dapat di harga 7131 tapi sekarang udah 7025 tapi gapapa sii apapun hpnya makin lama pasti makin turun jadii dapat...   , Lebih dari 1 tahun lalu, Varian: Black                ,             0, 2026-03-11T23:20:32.819822
827b9a999c63, https://www.tokopedia.com/milano-cell/fs-milano-apple-iphone-17-256gb-garansi-resmi-1733680775158727703, [FS MILANO] Apple iPhone 17 256GB Garansi Resmi - Black             , Milano Cell    , Anonymous    ,      5, Alhmdllh amanah.. Ori dan garansi ibox.. Mudah2an awet. Cmn sayang lama bgt ngrim nya dari jkt ke sukabumi.. Tapi keren barang.. Makasih kakak2 yang baik hati 😂🙏            , Lebih dari 1 tahun lalu, Varian: Black                ,             0, 2026-03-11T23:20:32.990298
c0ff9e7beef4, https://www.tokopedia.com/milano-cell/fs-milano-apple-iphone-17-256gb-garansi-resmi-1733680775158727703, [FS MILANO] Apple iPhone 17 256GB Garansi Resmi - Black             , Milano Cell    , J***y        ,      5, Jujur aku takut ya sebenarnya beli iPhone di live live gitu takut ga amanah udh dag dig dug pokok ny mah tapi pas udh datang wah ini beneran asli garansi resmi Indonesia...   , Lebih dari 1 tahun lalu, Varian: White                ,             0, 2026-03-11T23:20:33.121794
4946ba258fe9, https://www.tokopedia.com/milano-cell/fs-milano-apple-iphone-17-256gb-garansi-resmi-1733680775158727703, [FS MILANO] Apple iPhone 17 256GB Garansi Resmi - Black             , Milano Cell    , a***a        ,      5, "co jumat,minggu dah sampe sidoarjoo alhamdulillah rekomended!aslinya ketar ketir takut gasesuai ekspetasi,tapi alhamdulillah ga ngecewain samsek,harga muraahh,gratis ongk...", Lebih dari 1 tahun lalu, Varian: White                ,             0, 2026-03-11T23:20:33.254094
03ebb34696e1, https://www.tokopedia.com/milano-cell/fs-milano-apple-iphone-17-256gb-garansi-resmi-1733680775158727703, [FS MILANO] Apple iPhone 17 256GB Garansi Resmi - Black             , Milano Cell    , Anonymous    ,      5, "Bagus bgt si asli,sedikit kecewa si pengiriman nya lama doang cuman oke lah puas bgt sama hasilnya"                                                                           , Lebih dari 1 tahun lalu, Varian: White                ,             0, 2026-03-11T23:20:33.441984
da9662df93b1, https://www.tokopedia.com/milano-cell/fs-milano-apple-iphone-17-256gb-garansi-resmi-1733680775158727703, [FS MILANO] Apple iPhone 17 256GB Garansi Resmi - Black             , Milano Cell    , A***x        ,      5, Hp garansi resmi ibox dan dapat bonus emas.Pengiriman sesuai jadwal. Terima kasih Seller🙏                                                                                     , Lebih dari 1 tahun lalu, Varian: Black                ,             0, 2026-03-11T23:20:33.577803
10c087a59bf7, https://www.tokopedia.com/milano-cell/fs-milano-apple-iphone-17-256gb-garansi-resmi-1733680775158727703, [FS MILANO] Apple iPhone 17 256GB Garansi Resmi - Black             , Milano Cell    , Anonymous    ,      5, "Udh dteng dong kk, ori ibox, imei terdaftar dikemenperin, pokoknya terbaik👍👍👍"                                                                                             , Lebih dari 1 tahun lalu, Varian: Black                ,             0, 2026-03-11T23:20:33.738896
422d1553f38d, https://www.tokopedia.com/milano-cell/fs-milano-apple-iphone-17-256gb-garansi-resmi-1733680775158727703, [FS MILANO] Apple iPhone 17 256GB Garansi Resmi - Black             , Milano Cell    , Anonymous    ,      5, Sangat tidak mengecewakan bagus banget harga termurah dapat free tg dan case thank you milano                                                                                  , Lebih dari 1 tahun lalu, Varian: Purple               ,             0, 2026-03-11T23:20:33.901561
c4422d305f65, https://www.tokopedia.com/milano-cell/fs-milano-apple-iphone-17-256gb-garansi-resmi-1733680775158727703, [FS MILANO] Apple iPhone 17 256GB Garansi Resmi - Black             , Milano Cell    , c***a        ,      5, Diterima unit dengan baik dan packingan aman terjaga respon cepat dan sangat memuaskan beli aja di @wennywijaya tiktok shop sangat amanah dan terpercaya....                   , Lebih dari 1 tahun lalu, Varian: White                ,             0, 2026-03-11T23:20:34.044735
ab9d6ea49285, https://www.tokopedia.com/milano-cell/fs-milano-apple-iphone-17-256gb-garansi-resmi-1733680775158727703, [FS MILANO] Apple iPhone 17 256GB Garansi Resmi - Black             , Milano Cell    , Anonymous    ,      5, "Alhamdulillah masyaallah barang udah sampe masyaallah bgt dapet harga 6,9jt, pengiriman cepat, toko trusted amanah bgt deh, thankss ya🥰"                                     , Lebih dari 1 tahun lalu, Varian: White                ,             0, 2026-03-11T23:20:34.221231
